tweet,date,account
"What happens next for Amazon?

If the last 15 months are any indication, then the stock has a good chance of rallying again.

Read more with CNBC Pro:",2025-02-12T20:27:43.000Z,@CNBC
"Amazon primed for another comeback, according to the charts",2025-02-12T19:22:52.000Z,@CNBC
"Amazon opens beauty and personal care store in Italy, as part of brick-and-mortar expansion",2025-02-11T22:16:45.000Z,@CNBC
"Here are Monday's biggest analyst calls: Nvidia, Tesla, Mobileye, BJ's, Arm, Amazon, Disney, Home Depot & more",2025-02-10T13:34:12.000Z,@CNBC
No tweets found,N/A,BreakoutStocks
Brazil's Lula to meet with agency on Petrobras' bid to drill near mouth of Amazon river http://reut.rs/4aYn0Zp,2025-02-12T19:35:06.000Z,@Reuters
"Amazon Presidents’ Day Sale Just Started—Here Are The Best Deals
https://go.forbes.com/c/x4JJ",2025-02-11T00:30:05.000Z,@Forbes
Amazon And Laurene Powell Jobs Are Betting On This Nuclear Reactor Startup https://trib.al/ryKU01R,2025-02-09T05:30:05.000Z,@Forbes
